{
  "schema_version": "1.0.0",
  "registry_id": "astravalue.data_sources",
  "registry_version": "1.0.0",
  "effective_at": "2026-09-03T00:00:00Z",
  "question_set_version": "1.0.0",
  "definitions": [
    {
      "source_definition_id": "cninfo.disclosures",
      "version": "1.0.0",
      "upstream_identity": "深圳证券信息有限公司巨潮资讯网法定信息披露平台",
      "display_name": "巨潮资讯",
      "authority_level": 5,
      "adapter_key": "cninfo",
      "policy_status": "enabled",
      "enabled": true,
      "access_method": "https_api",
      "scopes": ["business_model"],
      "scope_version": "v1",
      "topics": ["company_identity", "prospectus", "periodic_report", "business_announcement"],
      "applicability": {"markets": ["ALL"], "tickers": [], "excluded_tickers": []},
      "refresh_frequency": "daily",
      "initial_request_allowlist": [
        {"scheme": "https", "host": "www.cninfo.com.cn", "port": 443, "path_prefix": "/new/"}
      ],
      "redirect_allowlist": [
        {"scheme": "https", "host": "www.cninfo.com.cn", "port": 443, "path_prefix": "/"},
        {"scheme": "https", "host": "static.cninfo.com.cn", "port": 443, "path_prefix": "/"}
      ],
      "source_timezone": "Asia/Shanghai",
      "published_at_precision": "instant",
      "incremental_policy": {
        "overlap_days": 14,
        "canonical_id_required": true,
        "use_etag": true,
        "use_last_modified": true,
        "hash_is_final": true,
        "checkpoint_compatible_from_versions": [],
        "historical_reconcile_days": 90,
        "silent_replacement_limit": "有限重叠窗口不能保证发现窗口外静默替换，按季度reconcile抽查历史资源。"
      },
      "retention_policy": {"discovery_body": "minimal_proof", "content_body": "allowed", "independent_replay_required": false},
      "response_limits": {"max_response_bytes": 67108864, "max_compressed_bytes": 67108864, "max_decompressed_bytes": 134217728, "max_redirects": 3},
      "rate_limit": {"max_concurrency": 1, "min_interval_seconds": 1.0, "workspace_shared": true},
      "retry_policy": {
        "max_attempts": 3,
        "retryable_methods": ["GET", "HEAD", "POST"],
        "initial_backoff_seconds": 1.0,
        "max_backoff_seconds": 8.0,
        "retry_after_cap_seconds": 30.0,
        "request_timeout_seconds": 30.0,
        "attempt_deadline_seconds": 120.0
      },
      "license_policy": {
        "automated_access": "allowed",
        "archive_original": "allowed",
        "save_derived_text": "pending",
        "llm_processing": "pending",
        "access_cost": "free",
        "evidence_basis": "继承现有公开披露端点的最小兼容策略；任何真实联网前仍须按9.1人工复核当日路径、许可和LLM条款。",
        "checked_at": "2026-09-03T00:00:00Z",
        "restrictions": ["禁止登录、验证码、付费墙或访问限制绕过", "LLM处理在人工条款复核前失败关闭"]
      },
      "live_access_review": {"status": "pending", "checklist_version": "business_model_v1.9.1", "completed_checks": [], "reviewed_at": null, "reviewed_by": null, "evidence_reference": null},
      "effective_at": "2026-09-03T00:00:00Z",
      "expires_at": null,
      "queries": [
        {
          "query_id": "cninfo.company_bootstrap",
          "query_family": "company_bootstrap",
          "query_stage": "discovery",
          "execution_key": "cninfo.company_bootstrap.v1",
          "adapter_operation": "bootstrap_company",
          "question_ids": ["BM.Q01.IDENTITY_BUSINESS_MODEL"],
          "request_method": "GET",
          "endpoint": "https://www.cninfo.com.cn/new/data/szse_stock.json",
          "parameter_template": {},
          "allowed_parameter_names": [],
          "partition_key": "company_identity",
          "earliest_available_at": "1990-12-19T00:00:00Z",
          "max_window_days": null,
          "pagination": {"strategy": "none", "page_parameter": null, "page_size_parameter": null, "page_size": null, "cursor_parameter": null, "termination": "single_response", "total_path": null, "items_path": "stockList"},
          "discovery_schema": {
            "schema_id": "cninfo.stock-list",
            "schema_version": "1",
            "response_mime_types": ["application/json", "text/json"],
            "root_type": "object",
            "required_paths": ["stockList"],
            "resource_fields": {"canonical_id": "stockList[].code", "url": "$request_url", "title": "stockList[].zwjc"}
          },
          "discovery_body_policy": "minimal_proof",
          "fetch_policy": "metadata_only",
          "canonical_id_rule": "cninfo-org:{code}:{orgId}",
          "smoke_enabled": true
        },
        {
          "query_id": "cninfo.prospectus",
          "query_family": "prospectus",
          "query_stage": "discovery",
          "execution_key": "cninfo.prospectus.v1",
          "adapter_operation": "execute_query",
          "question_ids": ["BM.Q01.IDENTITY_BUSINESS_MODEL", "BM.Q03.COUNTERPARTY_CHANNEL", "BM.Q04.UNIT_ECONOMICS_PRICING", "BM.Q07.RD_INPUT_EFFICIENCY", "BM.Q08.VALUE_CHAIN", "BM.Q10.COMPETITIVE_CLAIMS_EVIDENCE"],
          "request_method": "POST",
          "endpoint": "https://www.cninfo.com.cn/new/hisAnnouncement/query",
          "parameter_template": {"ticker": "{ticker}", "start_date": "{start_date}", "end_date": "{end_date}", "category": "prospectus"},
          "allowed_parameter_names": ["ticker", "start_date", "end_date", "category"],
          "partition_key": "prospectus",
          "earliest_available_at": "1990-12-19T00:00:00Z",
          "max_window_days": 365,
          "pagination": {"strategy": "page", "page_parameter": "pageNum", "page_size_parameter": "pageSize", "page_size": 30, "cursor_parameter": null, "termination": "declared_total", "total_path": "totalRecordNum", "items_path": "announcements"},
          "discovery_schema": {
            "schema_id": "cninfo.announcements",
            "schema_version": "1",
            "response_mime_types": ["application/json", "text/json"],
            "root_type": "object",
            "required_paths": ["announcements", "totalRecordNum"],
            "resource_fields": {"canonical_id": "announcements[].announcementId", "url": "announcements[].adjunctUrl", "title": "announcements[].announcementTitle", "published_at": "announcements[].announcementTime"}
          },
          "discovery_body_policy": "minimal_proof",
          "fetch_policy": "required_attachment",
          "canonical_id_rule": "announcementId; fallback normalized(ticker,title,announcementTime)",
          "smoke_enabled": false
        },
        {
          "query_id": "cninfo.periodic_report",
          "query_family": "periodic_report",
          "query_stage": "discovery",
          "execution_key": "cninfo.periodic_report.v1",
          "adapter_operation": "execute_query",
          "question_ids": ["BM.Q01.IDENTITY_BUSINESS_MODEL", "BM.Q02.PRODUCT_REGION_ECONOMICS", "BM.Q03.COUNTERPARTY_CHANNEL", "BM.Q04.UNIT_ECONOMICS_PRICING", "BM.Q05.CAPACITY_OPERATIONS", "BM.Q06.CAPEX_CYCLE", "BM.Q07.RD_INPUT_EFFICIENCY", "BM.Q08.VALUE_CHAIN", "BM.Q09.STRATEGY_CHANGES", "BM.Q10.COMPETITIVE_CLAIMS_EVIDENCE"],
          "request_method": "POST",
          "endpoint": "https://www.cninfo.com.cn/new/hisAnnouncement/query",
          "parameter_template": {"ticker": "{ticker}", "start_date": "{start_date}", "end_date": "{end_date}", "category": "periodic_report"},
          "allowed_parameter_names": ["ticker", "start_date", "end_date", "category"],
          "partition_key": "periodic_report",
          "earliest_available_at": "1990-12-19T00:00:00Z",
          "max_window_days": 365,
          "pagination": {"strategy": "page", "page_parameter": "pageNum", "page_size_parameter": "pageSize", "page_size": 30, "cursor_parameter": null, "termination": "declared_total", "total_path": "totalRecordNum", "items_path": "announcements"},
          "discovery_schema": {
            "schema_id": "cninfo.announcements",
            "schema_version": "1",
            "response_mime_types": ["application/json", "text/json"],
            "root_type": "object",
            "required_paths": ["announcements", "totalRecordNum"],
            "resource_fields": {"canonical_id": "announcements[].announcementId", "url": "announcements[].adjunctUrl", "title": "announcements[].announcementTitle", "published_at": "announcements[].announcementTime"}
          },
          "discovery_body_policy": "minimal_proof",
          "fetch_policy": "required_attachment",
          "canonical_id_rule": "announcementId; fallback normalized(ticker,title,announcementTime)",
          "smoke_enabled": true
        },
        {
          "query_id": "cninfo.business_announcement",
          "query_family": "business_announcement",
          "query_stage": "discovery",
          "execution_key": "cninfo.business_announcement.v1",
          "adapter_operation": "execute_query",
          "question_ids": ["BM.Q02.PRODUCT_REGION_ECONOMICS", "BM.Q04.UNIT_ECONOMICS_PRICING", "BM.Q05.CAPACITY_OPERATIONS", "BM.Q06.CAPEX_CYCLE", "BM.Q09.STRATEGY_CHANGES", "BM.Q10.COMPETITIVE_CLAIMS_EVIDENCE"],
          "request_method": "POST",
          "endpoint": "https://www.cninfo.com.cn/new/hisAnnouncement/query",
          "parameter_template": {"ticker": "{ticker}", "start_date": "{start_date}", "end_date": "{end_date}", "category": "business_announcement"},
          "allowed_parameter_names": ["ticker", "start_date", "end_date", "category"],
          "partition_key": "business_announcement",
          "earliest_available_at": "1990-12-19T00:00:00Z",
          "max_window_days": 90,
          "pagination": {"strategy": "page", "page_parameter": "pageNum", "page_size_parameter": "pageSize", "page_size": 30, "cursor_parameter": null, "termination": "declared_total", "total_path": "totalRecordNum", "items_path": "announcements"},
          "discovery_schema": {
            "schema_id": "cninfo.announcements",
            "schema_version": "1",
            "response_mime_types": ["application/json", "text/json"],
            "root_type": "object",
            "required_paths": ["announcements", "totalRecordNum"],